topic_no	test_statistic	p-value	topic_words
topic_36	9.283462039232132	1.2745558889644409e-18	je non dire oui rien plus cette chose faire sais jamais quelque ça puis voir voulez crois pu femme parler 
topic_49	8.507956396871098	3.6096606776182165e-16	yeux main vers tête fit voix puis porte plus visage regard homme mains air devant prit derrière demanda contre regarda 
topic_45	8.488115084148687	2.9781845536103896e-16	faire bix après fit trevarrow mort packer mère plus voir père pendant dire lorsque famille pouvait mieux lorsqu docteur situation 
topic_22	7.23483972776881	2.008838890208377e-12	thursday throgmorton haslett greening homme hedlam clapp tarrant gayleigh grilat gillespie mounier bureau café legge peyosi banks cope osborn hempstead 
topic_04	7.060850038073244	5.816849604383971e-12	porte chambre je heures plus lit nuit heure après faire cette temps fenêtre chose personne quelque non soir aller chez 
topic_02	6.7076101810791595	6.008975915980104e-11	pendlebury wagstaffe inspecteur holt thurston monsieur oncle fayrer hobart répondit scranton fellowes townsend bingley strickland surintendant minnoch béthune turnbull noirot 
topic_37	6.119504755468213	2.0521980175469304e-09	dab houghton école fredrika pascoe walters venner tosse docteur kilander lialena sansone lagervall ingun uno inspecteur homme estes potts fiches 
topic_19	5.921837556018157	5.6402011134061335e-09	merrivale bewlay masters colonel estivar brinkley march oui professeur ranch air cependant monsieur répondit ransom fit valenzuela commandant présent eh 
topic_32	5.900669441968371	6.688014544251721e-09	jeune femme plus fille homme yeux cheveux cette visage air sourire regard vers toujours femmes jamais voix grand robe tête 
topic_41	5.434171343808406	8.477495994904175e-08	père tante oncle famille frère mère enfant testament après femme mort cette jamais nom grand jeune parents vieille années burden 
topic_01	4.82293813601111	1.8948650796300702e-06	plus ça toujours jamais faire père chez temps cette dire après mère beaucoup chose rien pouvait savait faisait enfants voulait 
topic_20	4.596643239387602	5.231284901835798e-06	téléphone je heures bureau numéro oui voix police chez porte allô appareil heure voiture gamadge raccrocha nom lorsque vers aveyard 
topic_10	3.0327943601529137	0.0025610104289087434	cabine bateau caldwell krantz mer pont bord howery badge shipka earnshaw nicholson toffy plus nalpas commandant passagers salon coursive burr 
topic_29	2.8430761240280367	0.0046891127720334255	plus corps coup revolver main mort tête cadavre arme homme vers visage cette contre après puis bruit mains feu couteau 
topic_12	2.763128763746951	0.005959380238975378	dr docteur médecin gallois infirmière hôpital malade mort loureiro service plus quelques chef médecins autopsie coroner clinique inspecteur maladie malades 
topic_08	2.2167078565700358	0.02733121863403019	voiture route plus vers chemin devant côté jusqu loin heure nuit quelques endroit après près minutes heures derrière faire temps 
topic_27	2.209859972279991	0.02762135221084891	porte plus cette murs devant fenêtres escalier côté fenêtre grand mur derrière entrée grande étage intérieur bois dessus quelques face 
topic_26	1.7099021847123237	0.0878387141503382	plus feu faire incendie nims lefleur radio mètres dessus corps tente entre près chose abri pouvait côté ça demanda quelqu 
topic_05	1.4890999534215825	0.13740479234730832	verre table café cuisine eau thé bouteille manger boire verres après dîner bencolin tasse plateau whisky déjeuner soir repas bière 
topic_48	1.3714710920271145	0.17074072011009697	cribb thackeray mc innés vibart lieutenant dunoyau severn monk combat chips herriott agent piste feu hall jacobson chef trimbal autres 
topic_34	1.34429065978194	0.1795516187922339	eau sac jumeaux plus chien parc faisait cheveux petits entre drury plastique animal jours leurs puma photos trois cheval bout 
topic_30	0.4778067443397365	0.6330532785659981	ça hungerford devarest faire holmes wiggins boyle whitewell dr cette bainbridge forstmann fit doyen cool framley lonsback vers dis demandai 
topic_42	0.05328445633068658	0.9575428696843234	cette plus voix nuit lherbier temps semblait puis yeux bruit toute silence quelque présent pouvait soudain chose toujours pourtant pluie 
topic_16	-0.08815301465878612	0.9298234317532006	todhunter tennison otley shefford norwood farroway chitterwick chef barleduc burkin fit montluçon demanda havers amson revolver madame hommes répondit dossier 
topic_39	-0.37743241584668025	0.7062844735526442	withers mme scène vialles théâtre inspecteur cochart dobie hôtel miloz nincom monestier jeune français grand demanda ducaux orchestre rôle studio 
topic_46	-0.48455999098367597	0.6284913143521458	grouchko je dis bemie ça keif plus train mec faire milioukine tête fit chiens pouvais vraiment chose mafia voiture air 
topic_23	-0.5170085691423457	0.6057191107428823	finch flaty eventreur powell hallward ça demanda femme celui bartlett whitechapel spencers chef macey village bingham purple policier street livres 
topic_21	-0.5794937691431717	0.562958626040642	talolahti ça bureau fit petersen ordinateur degerman plus oddie déjà tueur mme lampinen turpin gizmo amburgey quelques passe riistala données 
topic_06	-0.7844127317457823	0.4333615696448313	noblet beecher fountain heap filby amberley ça gubbins tooley tabora curtebœuf commissaire fit dogtinder scales demanda garde cuisine manoir piaget 
topic_07	-1.1799337256516285	0.2392949073929551	campion piggot betts baumann steinemann pr plus yeux faraday thôffel horrocks fédéral lorsque monsieur père somerville madame suisse leurs banque 
topic_13	-1.5570716988092954	0.1213383671219169	gare train toke fit thomdyke ronsac quai cigare thorndyke wagon badger compartiment homme polton pendule assez dobey toutes cependant voyage 
topic_00	-1.810293076329025	0.07116524900706893	je dis puis demandai vers vis yeux lorsque tête pouvais porte entendis savais pris air main rien coup regardai sentais 
topic_14	-2.3037933075410604	0.022417507455174995	plus tarchinini je canzo quelques delarue cette enfin jusqu peine commissaire presque agent ça hé cet quant oldham bellagio michaudon 
topic_28	-2.307834176417894	0.022238968402710755	thanet madame pettifer club carmandine fauteuil lovestone solda vieille lineham brème procacci piano ça crime hanzard lafarge lacenaire troppmann vampire 
topic_47	-2.4882024795045155	0.013783011798581797	directeur monsieur plus regarde mugnier dulières oui parc président yeux vers pense coulon demande non rien sérigny jeune vient tête 
topic_33	-2.7218160421958504	0.006917815370589684	je inspecteur plus cette après homme oui monsieur heures puis non heure vers fit demanda répondit quelques temps jeune dire 
topic_03	-2.7842628538946657	0.0057647574711536	step brandshaft hartford fit blackie cook ça avocat plessis ayres herrington gayleigh déclara bankhart patinay peveley weygand bureau sénateur tattleberry 
topic_17	-2.8482341501597888	0.004970651030408034	fellows commissaire fille wilks parry plage moore femme heures bonetti photo ça morte pittsfield août garçon cette kirschner pilote rien 
topic_38	-3.023633175753243	0.0027859223999279975	je lettre cette plus bureau enveloppe papier yard puis affaire inspecteur police livres scotland nom lettres londres quelques homme banque 
topic_24	-3.1531659238637912	0.001926621019808592	commissaire monsieur inspecteur mme chaumet boisson fit lansing bousquet lettre détective madame maillard darrieu adair lebihan hôtel boulle avocat mosby 
topic_09	-3.499097674369365	0.0005704587508967578	plus homme leurs bureau directeur hommes quatre autres rosbach grande fen casteljal société grand entre ministre chef affaire professeur pays 
topic_25	-3.9748461808234468	0.00010510405439451415	je commissaire monsieur dancourt mme oui giraudas inspecteur dauvergne île café mémé soir vers heure regard nuit porte yeux koubbian 
topic_40	-4.296799528551255	2.4944386542275056e-05	je plus faire cette rien non vais dire sais veux quelques après oui doute crois jamais faut prendre temps mieux 
topic_18	-4.300520912617	2.4604774401611203e-05	cette plus pu crime faire mort après meurtre police affaire rien personne assassin cas non pouvait celui autres enquête aucun 
topic_11	-4.930434221285975	1.9811906733281454e-06	plus monsieur après mme cette commissaire fombieux client castelet heures sourlot rien ferrières crime heure non vassal enfin album chez 
topic_44	-5.35583048543223	2.9468051296967426e-07	mcfee dodd école nettleton mlle monsieur professeur détective fontannes santais élèves anglais portier directeur bordier chef français pemberly classe dortoir 
topic_31	-5.492869345222934	1.2014598422320016e-07	plus après trois jour quelques jours rien heures lettres temps dix nom quoi quelque jamais cinq ça chose autres journal 
topic_35	-6.033953840130641	9.923500260230747e-09	je ça faire plus non sais rien dire quoi jamais veux toujours temps dis faut chose peux oui voir coup 
topic_43	-7.105091262397293	3.8832584296030404e-11	wexford pascoe huby dalziel beaupré wield castagnac fit keech dearborn thackeray lomas goodenough watmough vollans demanda stick padgett vieille pontelli 
topic_15	-9.623530846344904	8.486365025462421e-18	femme cette plus fille jamais mère jour mme toujours pouvait jeune père pauvre rien mariage cœur toute seule vivre enfant 
